title,skills,salary,company,job_description,link
Викладач у дитячу IT-школу програмування (Python),"CSS,JavaScript,HTML,Python,Комунікабельність,Програмування,Креативність,Робота з дітьми,Бажання вчитися і розвиватися",5000–10000 UAH,"Logika, мiжнародна школа програмування для дiтей","ПРО ШКОЛУ: Ми впроваджуємо новітні IT технології в навчання школярів. На наших уроках діти не лише вчаться основам програмування, вони розвивають своє логічне та критичне мислення і вміння думати та аналізувати інформацію, в проєктній роботі проявляти креативність та творчі здібності. Ми пропонуємо:  Робота у вихідні (субота, неділя). Можлива зайнятість в будні дні друга половина дня.  Вчасна виплата заробітної плати.  Постійне навчання за рахунок компанії від наших професіоналів.  Круте ком’юніті однодумців та комплексну базу знань для співробітників!  Мотивацію для викладачів!  Зайнятість від 2−7 груп  Заробітна плата: від 400 грн за один урок (в залежності від кількості дітей у групі)  Обов`язки:  Проводити офлайн заняття із використанням вже готових методичних та практичних матеріалів школи Logika;  Створювати та підтримувати дружню робочу атмосферу на заняттях;  Слідкувати за результатами учнів;  Вчасно заповнювати адміністративну звітність;  Проводити відкриті уроки для батьків, та давати зворотній зв’язок про навчання дітей;  Отримувати задоволення від роботи із майбутнім нашої країни;  Хто нам потрібен?:  Потрібні  енергійні  та  вмотивовані  викладачі, які ладнають із комп’ютером на «ти» та мають  активний підхід  до своєї роботи.  Високо розвинені  комунікативні  навички , досвід публічних виступів  Любов до дітей  та  бажання  навчати та навчатись разом із ними!  Знання мінімум одної мови програмування:  Python,Lua, HTML,CSS, JavaScript  та величезне  бажання вивчати  нове).  Великою перевагою буде  вища освіта в області ІТ ,  педагогіки/психології.  Кандидати  з досвідом роботи з дітьми  в пріоритеті.  Якщо у Вас ще немає досвіду, але є хист і бажання, школа пропонує навчання і підтримку. Якщо саме ВИ бажаєте власноруч змінювати освіту на краще — чекаємо на Вас в Logika! Не втрачайте можливість — хутчіш залишайте відгук, або ж телефонуйте/пишіть:  0955641301 Show phone  Михайло.",https://www.work.ua/en/jobs/5283314/
"Викладач у школу програмування (Python, Roblox Studio, Scratch, комп'ютерна грамотність)","CSS,JavaScript,HTML,Python,Комунікабельність,Програмування,Креативність,Scratch",8000–14000 UAH,"Logika, мiжнародна школа програмування для дiтей","Ш кола Logika  активно розвивається, тому шукаємо викладачів у нашу школу! У нас присутні курси:  Комп’ютерна грамотність, Scratch, Геймдизайн, Python.  ПРО ШКОЛУ:  Ми впроваджуємо новітні IT технології в навчання школярів. На наших уроках діти не лише вчаться основам програмування, вони розвивають своє логічне та критичне мислення і вміння думати та аналізувати інформацію, в проєктній роботі проявляти креативність та творчі здібності. Ми пропонуємо:  Зайнятість від 3−6+ груп  від 400 грн. за одне заняття (в залежності від кількості дітей у групі)   Гнучкий графік, можливість обрати для себе робочі години.  Графік занять узгоджується.  Вчасна виплата заробітної плати.  Постійне навчання за рахунок компанії від наших професіоналів.  Круте ком’юніті однодумців та комплексну базу знань для співробітників!  Мотивацію для викладачів!  Обов`язки:  Проводити офлайн заняття на локації із використанням вже готових методичних та практичних матеріалів школи Logika;  Створювати та підтримувати дружню робочу атмосферу на заняттях;  Слідкувати за результатами учнів;  Вчасно заповнювати форми та адміністративну звітність;  Проводити відкриті уроки для батьків, та давати зворотній зв’язок про навчання дітей;  Хто нам потрібен?:  Потрібні  енергійні  та  вмотивовані  викладачі, які ладнають із комп’ютером на «ти» та мають  активний підхід  до своєї роботи.  Високо розвинені  комунікативні  навички , досвід публічних виступів  Любов до дітей  та  бажання  навчати та навчатись разом із ними!  Знання мінімум одної мови програмування:  Python,Scratch, Lua, HTML,CSS, JavaScript  та величезне  бажання вивчати  нове).  Великою перевагою буде  вища освіта в області ІТ ,  педагогіки/психології.  Кандидати  з досвідом роботи з дітьми  в пріоритеті.  Якщо у Вас ще немає досвіду, але є хист і бажання, школа пропонує навчання і підтримку. Якщо саме ВИ бажаєте власноруч змінювати освіту на краще — чекаємо на Вас в Logika!  Не втрачайте можливість — хутчіш залишайте відгук, або ж телефонуте/пишіть:  +380955641301 Show phone  — Михайло Telegram: @redlight312",https://www.work.ua/en/jobs/4912146/
Викладач IT (Python/C++),"Викладання,Python,C++,Уважність,Професіоналізм,Робота з дітьми",,Step,"Ми міжнародна комп’ютерна Академія  « IT   Step »  — лідери IT-освіти в Україні та Європі. Наша ціль — розвивати таланти та формувати висококваліфікованих професіоналів у сфері IT. Освіта — найкраща інвестиція в успішне майбутнє. Наразі шукаємо спеціаліста, який готовий поділитися своїми знаннями та допомогти підліткам розвиватися в сучасному світі технологій. Викладання в Академії легко поєднувати з іншим місцем роботи. Формат — офіс, м. Калуш. Графік роботи — гнучкий, парт-тайм (2−3 дні на тиждень по 2 пари).  ВІД КАНДИДАТА ОЧІКУЄМО:  знання Python та/або C++;   вміння працювати зі студентами 15−21 років;  бажання освоювати нові дисципліни (в чому ми готові допомагати!).   ВАШІ МАЙБУТНІ ЗАДАЧІ:  проведення занять з навчальної дисципліни у цікавій ігровій формі;  забезпечення досягнення студентами практичних результатів навчання, оцінювання їх робіт;  відмічання присутніх на лекції;  перевірка домашнього завдання.  МИ ПРОПОНУЄМО:  роботу в міжнародній компанії, що твердо стоїть на ринку та є лідером у своїй сфері;  професійний розвиток в декількох напрямках ІТ та педагогіці;  фіксовану ставку за заняття та прогресивне зростання заробітної плати в залежності від досягнень по прозорим показникам роботи;  автоматизовані системи обліку занять, оцінювання, комунікації зі студентами (у нас немає паперових журналів, звітів та іншої документації);  обладнані сучасні робочі місця в філіях та корпоративні онлайн-сервіси.  Якщо Ви маєте бажання приєднатися до нашої команди та сприяти розвитку талановитої молоді, надсилайте своє резюме. Ми з нетерпінням чекаємо на Вашу кандидатуру! Телеграм: @tradchenko_it Пошта: [ apply ]",https://www.work.ua/en/jobs/5705094/
"Викладач програмування у дитячу школу (Python, Scratch)","Python,Програмування,Креативність",10000 UAH,"Logika, мiжнародна школа програмування для дiтей","Що таке Logika: Ми впроваджуємо новітні IT технології в навчання школярів. На наших уроках діти не лише вчаться основам програмування, вони розвивають логіку і вміння думати, а в проєктній роботі проявляють креативність та творчі здібності. У програму курсу  Logika  включені частини курсів з фізики, математики, хімії, астрономії, що допомагає дітям зрозуміти, навіщо шкільні предмети потрібні в реальному житті. Logika  активно розвивається і в зв’язку із розширеннями відбувається пошук викладачів! Ми пропонуємо:  Робота у субботу та неділю.  Графік занять узгоджується.  Заробітна плата: 350 грн / 1.5 години викладання.  Постійне навчання за рахунок компанії від наших професіоналів.  Круте ком’юніті однодумців!  Хто нам потрібен?:  Потрібні енергійні та вмотивовані викладачі, які ладнають із комп’ютером на «ти» та мають активний підхід до своєї роботи.  Необхідні знання у Python (Або ж досвід із іншими мовами програмування та бажання вивчати нове).  Великою перевагою буде вища освіта в області ІТ, або ж педагогіки/психології.  Кандидати з досвідом роботи з дітьми в пріоритеті.  Якщо у Вас ще немає досвіду, але є хист і бажання, школа пропонує навчання і підтримку.  Обов`язки:  Проводити офлайн заняття із використанням вже готових методичних матеріалів школи  Logika ;  Створювати та підтримувати дружню робочу атмосферу на заняттях;  Слідкувати за результатами учнів;  Давати звіти за шаблонами;  Отримувати задоволення від роботи із майбутнім нашої країни;  Якщо саме ВИ бажаєте власноруч змінювати освіту на краще — чекаємо на Вас в  Logika ! Не втрачайте можливість — хутчіш залишайте відгук, або ж телефонуте/пишіть: 0685594550 Show phone  Роман",https://www.work.ua/en/jobs/5386269/
Full Stack Python developer,"CSS,HTML,PHP,SQL,JavaScript,Python,PostgreSQL,Agile,Відповідальність,Знання принципів ООП,Docker,Django,Django Rest Framework,REST,REST API,Redis,Celery,SOLID Principles",,LightSoft,"LightSoft is seeking a talented Python Developer to join our dynamic team for a full-time remote position. As a valued member, you’ll play a crucial role in contributing to exciting high-load video hosting projects. Responsibilities: As a pivotal team member, you will:  Write Python code based on functional specifications, adhering to architectural standards and developing designs that seamlessly integrate with the database and leverage existing code appropriately.  Conduct thorough code reviews, identifying potential issues to reduce technical debt, and offering coding best practice recommendations.  Develop and maintain tests, as well as manage projects developed on PHP.  Apply knowledge and experience at an architectural level of development, contributing to the design and implementation of robust and scalable solutions.  Migrate code from the old code base to a RESTful solution  Required skills: We are seeking candidates with:  A minimum of 3 years of experience in Python web development.  Strong proficiency in Django/Django REST framework.  Sound understanding of RESTful specifications.  Expertise with Redis, Celery, and SQL DB (preferably PostgreSQL).  Proficiency in Docker usage.  Experience with Agile methodology (preference for Kanban).  Solid grasp of OOP, design patterns, software development principles, and best practices.  As a plus: It would be beneficial if you have:  Experience with high-load projects.  Familiarity or strong knowledge of PHP.  Knowledge of HTML/CSS/JS.  Experience or strong knowledge of Sphinx.  What do we offer our new colleague? LightSoft provides:  Annual paid vacation.  A lack of bureaucracy and micromanagement.  Freedom to actively participate in decision-making and implementation.  Flexible working hours.  Join us in our mission to make the world and ourselves better!",https://www.work.ua/en/jobs/5706731/
"Викладач з програмування в онлайн-школу (Roblox, Python, Scratch)","Програмування,Roblox,Python,Scratch",15000–30000 UAH,Yo Academy,"Приєднуйся до команди Yo Academy — дитячої онлайн IT академії! Ми в Yo Academy віримо, що навчання може бути захоплюючим і цікавим! Ми шукаємо талановитих викладачів, які допоможуть нам втілити цю місію в життя, навчаючи дітей від 5 до 17 років програмуванню, дизайну, AI та іншим сучасним цифровим навичкам. Чому варто приєднатися до нас?  Захоплююча місія:  Ми перетворюємо нудне навчання в захоплюючий процес, щоб діти з радістю чекали кожного заняття.  Професійний розвиток:  У нас ти зможеш розвивати свої soft та hard skills, працюючи з найновішими технологіями та методиками навчання.  Гнучкий графік:  Працюй віддалено з будь-якої точки світу, обирай зручний для себе графік.  Своєчасна оплата:  Стабільна заробітна плата виплачується двічі на місяць.  Командна атмосфера:  Поринай у дружню атмосферу нашої команди, де кожен підтримує і надихає один одного.  Що тебе очікує:  Проведення захоплюючих курсів з програмування, робототехніки та сучасних технологій для різних вікових груп.  Створення інтерактивних навчальних програм, які поєднують теоретичні знання з практичними навичками.  Постійне оновлення навчальних матеріалів з урахуванням останніх трендів у сфері IT.  Персоналізована підтримка та зворотний зв’язок для кожного студента.  Співпраця з іншими викладачами та працівниками для вдосконалення освітніх пропозицій та стратегій.  Якщо ти прагнеш стати частиною команди професіоналів, які виховують майбутнє, не зволікай! Заповнюй форму за посиланням і приєднуйся до нашої команди:  Заповнити форму Разом ми створимо захоплююче майбутнє для наших студентів!",https://www.work.ua/en/jobs/5707720/
Python-програміст,"SQL,GitHub,GitLab,Python,PostgreSQL,MongoDB,Docker,Django,REST API,Програмування,Jenkins,Flask,AWS,pandas,NumPy,NoSQL,FastAPI,TensorFlow,Розробка API,CI/CD,PyTorch,GitHub Actions",90000–120000 UAH,Система-М,"Вимоги :   Досвід роботи з бібліотеками машинного навчання, такими як TensorFlow, PyTorch, Scikit-learn.  Розуміння алгоритмів машинного навчання (регресія, класифікація, кластеризація, рекомендаційні системи).  Досвід у розробці та застосуванні моделей прогнозування цін, управління запасами, застосування акцій тощо.  Збір та обробка даних:  Навички роботи з базами даних (SQL та NoSQL).  Досвід з інструментами для збирання та обробки даних, такими як Pandas, NumPy.  Досвід у веб-скрапінгу та використанні API для збирання даних.  Розробка API та ендпоінтів:  Знання RESTful API та досвід їх розробки за допомогою Flask, Django або FastAPI.  Досвід у роботі з сервісами хмарних обчислень (AWS, Google Cloud, Azure) для деплойменту моделей та API.  Додаткові навички:  Досвід з Docker для контейнеризації додатків.  Розуміння принципів CI/CD для автоматизації розгортання.  Навички роботи з інструментами для моніторингу та логування (наприклад, ELK stack).  Рекомендований стек технологій:  Мова програмування: Python  Бібліотеки для машинного навчання: TensorFlow, PyTorch, Scikit-learn  Інструменти для обробки даних: Pandas, NumPy  Бази даних: PostgreSQL, MongoDB  Фреймворки для розробки API: Flask, Django, FastAPI  Хмарні платформи: AWS, Google Cloud, Azure  Контейнеризація: Docker  CI/CD: Jenkins, GitLab CI, GitHub Actions  Умови роботи :  Повна зайнятість, оплачувані відпустки Обов’язки :  Все, що описано у Вимогах, залежно від поточних потреб проектів",https://www.work.ua/en/jobs/5712801/
Python Developer,"Git,Відповідальність,Docker,Unit-тестування,Програмування,Flask,AWS,pandas,NumPy,Backend-розробка,PyTest,Machine learning",80000–120000 UAH,Siema,"SIEMA TECH  is an international IT company that provides services in the field of software development and consulting. We work with clients from all over the world and use the most modern technologies to ensure the high quality of our work. We are seeking a skilled and motivated  Python Developer  to join our dynamic team. Education and Experience:  A degree in Computer Science, Software Engineering, or a related field is often required.  At least 5 years as Software devoloper in know Software companies or StartUps.  At least 3 years of experience working as a Python developer.  English level: upper intermediate  and above.  Technical Skills:  Proficiency in Python : strong knowledge of Python programming language, including its syntax, idioms, and ecosystem.  Frameworks and libraries : experience with popular Python frameworks and libraries like FastAPI, Flask, Pandas, NumPy, etc.  Database knowledge : familiarity with databases such as SQL, PostgreSQL, MongoDB, etc.  Version control : experience with version control systems like Git.  Testing : familiarity with testing frameworks like unittest, pytest, etc.  Responsibilities:  Software development : writing clean, maintainable, and efficient code.  Integration and deployment : integrating backend services with frontend counterparts and deploying applications.  Testing and debugging : writing unit tests and debugging applications.  Documentation : documenting code and technical specifications.  Adventage:  DevOps : experience with containerization technologies like Docker, and orchestration tools like Kubernetes.  Cloud services : knowledge of cloud platforms like AWS, Azure, or Google Cloud Platform.  Machine learning : basic understanding of machine learning concepts and libraries, and understanding MLPOS life cycle.  We offer:  Ability to work with modern technologies and high-quality projects.  Flexible work schedule and the ability to work remotely.  Assistance (in the absence) in the registration of the IE (legal and accounting support).  Training and continuous development: internal trainings, certification programs, communities of interest, English language courses.  Fully official salary (payment to the IE’s current account).   The interview consists of 4 stages: introductory interview, performance of the technical task, technical interview, interview with the client. If you are interested in this vacancy and meet the requirements, send your resume and motivation letter to our email. We look forward to welcoming you to our team!",https://www.work.ua/en/jobs/5709947/
